<?xml version="1.0" encoding="UTF-8"?>
<cine xmlns:xsi="http://www.w3.org/2001/XMLSchema-instance"
xsi:noNamespaceSchemaLocation="cinee.xsd">
    <pelicula estreno="1942" minutos="102">
        <titulo genero="drama">Casablanca</titulo>
        <director>Michael Curtiz</director>
        <valoracion nota="5"/>
        <reparto>
            <interprete>Humphrey Bogart</interprete>
            <interprete>Ingrid Bergman</interprete>
            <interprete>Paul Henreid</interprete>
            <interprete>Claude Rains</interprete>
            <interprete>Conrad Veidt</interprete>
            <interprete>Curt Bois</interprete>
        </reparto>
    </pelicula>
</cine>